{
  "contract_version": "0.0.0",
  "test_only": true,
  "artifact_status": "draft",
  "declared_deployment_class": "A_RESEARCH_CORE",
  "derived_minimum_deployment_class": "A_RESEARCH_CORE",
  "effective_deployment_class": "A_RESEARCH_CORE",
  "disclaimer_version": "2026-08-08",
  "regulatory_use_context": {
    "contract_version": "0.0.0",
    "declared_deployment_class": "A_RESEARCH_CORE",
    "derived_minimum_deployment_class": "A_RESEARCH_CORE",
    "effective_deployment_class": "A_RESEARCH_CORE",
    "operator_legal_entity": "not_applicable",
    "operator_jurisdiction": "not_applicable",
    "authorization_type": "not_applicable",
    "authorization_registry_id": "not_applicable",
    "client_specific": false,
    "instrument_scope": "cashflow_only",
    "alternatives_origin": "user_supplied",
    "ranking_enabled": false,
    "recommendation_language_enabled": false,
    "execution_enabled": false,
    "compensation_model": "none",
    "conflict_policy_id": "not_applicable",
    "suitability_record_id": "not_applicable",
    "human_reviewer_id": "not_applicable",
    "counsel_opinion_id": "not_applicable",
    "retention_policy_id": "not_applicable"
  },
  "intended_uses": [
    "contract_validation",
    "local_research"
  ],
  "prohibited_uses": [
    "individualized_recommendation",
    "order_execution",
    "benefit_guarantee",
    "tax_or_legal_determination",
    "suitability_certification",
    "causal_claim_without_identification"
  ],
  "model_use_status": "research_only",
  "policy_status": "not_applicable",
  "data_quality_status": "synthetic_only",
  "data_license_status": "no_external_data",
  "regulatory_use_status": "eligible",
  "reproducibility_class": "exact",
  "model_card": {
    "artifact_id": "model-card",
    "applicability": "not_applicable"
  },
  "policy_pack": {
    "artifact_id": "policy-pack",
    "applicability": "not_applicable"
  },
  "data_snapshot": {
    "artifact_id": "data-snapshot",
    "applicability": "not_applicable"
  },
  "authority_refs": [],
  "governance_reason_codes": [],
  "human_review": {
    "required": false,
    "completed": false,
    "reviewer_id": null,
    "reviewed_at": null
  }
}
